{
  "$schema": "https://json-schema.org/draft/2020-12/schema",
  "$id": "https://inferlab.ai/schemas/evidence/v1/envelope.schema.json",
  "title": "InferLab EvidenceEnvelope v1",
  "type": "object",
  "additionalProperties": false,
  "required": ["schema", "schema_version", "name", "classification", "completeness", "source", "runtime", "workload_digest", "attempt", "started_at", "artifacts"],
  "properties": {
    "schema": {"const": "inferlab.evidence"},
    "schema_version": {"const": "1.0"},
    "name": {"$ref": "#/$defs/name"},
    "classification": {"enum": ["observed", "predicted", "derived", "asserted"]},
    "completeness": {"enum": ["complete", "partial"]},
    "source": {"$ref": "#/$defs/source"},
    "runtime": {"$ref": "#/$defs/runtime"},
    "workload_digest": {"$ref": "#/$defs/digest"},
    "attempt": {"type": "integer", "minimum": 1},
    "started_at": {"type": "string", "format": "date-time"},
    "finished_at": {"type": "string", "format": "date-time"},
    "metrics": {
      "type": "array",
      "maxItems": 4096,
      "items": {"$ref": "#/$defs/metric"}
    },
    "artifacts": {
      "type": "array",
      "minItems": 1,
      "maxItems": 256,
      "items": {"$ref": "#/$defs/artifact"}
    },
    "parent_digests": {
      "type": "array",
      "maxItems": 256,
      "uniqueItems": true,
      "items": {"$ref": "#/$defs/digest"}
    },
    "transformation": {"$ref": "#/$defs/transformation"}
  },
  "$defs": {
    "revision": {"type": "string", "pattern": "^(?:[0-9a-f]{40}|[0-9a-f]{64})$"},
    "digest": {"type": "string", "pattern": "^sha256:[0-9a-f]{64}$"},
    "identifier": {"type": "string", "minLength": 1, "maxLength": 256},
    "name": {"type": "string", "pattern": "^[a-z0-9](?:[a-z0-9._-]{0,126}[a-z0-9])?$"},
    "source": {
      "type": "object",
      "additionalProperties": false,
      "required": ["tool", "tool_version", "report_schema", "adapter", "adapter_revision"],
      "properties": {
        "tool": {"$ref": "#/$defs/name"},
        "tool_version": {"$ref": "#/$defs/identifier"},
        "report_schema": {"$ref": "#/$defs/identifier"},
        "adapter": {"$ref": "#/$defs/name"},
        "adapter_revision": {"$ref": "#/$defs/revision"}
      }
    },
    "model": {
      "type": "object",
      "additionalProperties": false,
      "properties": {
        "id": {"$ref": "#/$defs/identifier"},
        "revision": {"$ref": "#/$defs/revision"},
        "tokenizer_id": {"$ref": "#/$defs/identifier"},
        "tokenizer_revision": {"$ref": "#/$defs/revision"},
        "quantization": {"$ref": "#/$defs/name"},
        "quantization_config_digest": {"$ref": "#/$defs/digest"}
      }
    },
    "engine": {
      "type": "object",
      "additionalProperties": false,
      "properties": {
        "name": {"$ref": "#/$defs/name"},
        "revision": {"$ref": "#/$defs/revision"},
        "container_image": {"type": "string", "pattern": "^[^\\s@]+@sha256:[0-9a-f]{64}$"}
      }
    },
    "platform": {
      "type": "object",
      "additionalProperties": false,
      "properties": {
        "cuda_version": {"$ref": "#/$defs/identifier"},
        "driver_version": {"$ref": "#/$defs/identifier"},
        "gpu_sku": {"$ref": "#/$defs/identifier"},
        "gpu_count": {"type": "integer", "minimum": 1, "maximum": 1024},
        "topology": {"$ref": "#/$defs/identifier"}
      }
    },
    "scheduler": {
      "type": "object",
      "additionalProperties": false,
      "properties": {
        "name": {"$ref": "#/$defs/name"},
        "config_digest": {"$ref": "#/$defs/digest"}
      }
    },
    "kernel": {
      "type": "object",
      "additionalProperties": false,
      "required": ["name", "version", "config_digest"],
      "properties": {
        "name": {"$ref": "#/$defs/name"},
        "version": {"$ref": "#/$defs/identifier"},
        "config_digest": {"$ref": "#/$defs/digest"}
      }
    },
    "runtime": {
      "type": "object",
      "additionalProperties": false,
      "required": ["schema", "schema_version", "origin", "model", "engine", "platform", "scheduler", "kernels"],
      "properties": {
        "schema": {"const": "inferlab.runtime-signature"},
        "schema_version": {"const": "1.0"},
        "origin": {"enum": ["declared", "observed"]},
        "model": {"$ref": "#/$defs/model"},
        "engine": {"$ref": "#/$defs/engine"},
        "platform": {"$ref": "#/$defs/platform"},
        "scheduler": {"$ref": "#/$defs/scheduler"},
        "kernels": {"type": "array", "maxItems": 64, "items": {"$ref": "#/$defs/kernel"}}
      }
    },
    "metric": {
      "type": "object",
      "additionalProperties": false,
      "required": ["name", "semantics", "value", "unit", "sample_count"],
      "properties": {
        "name": {"$ref": "#/$defs/name"},
        "semantics": {"$ref": "#/$defs/name"},
        "value": {"type": "number"},
        "unit": {"enum": ["count", "milliseconds", "probability", "ratio", "seconds", "tokens", "tokens_per_second", "usd"]},
        "sample_count": {"type": "integer", "minimum": 1}
      }
    },
    "artifact": {
      "type": "object",
      "additionalProperties": false,
      "required": ["name", "media_type", "digest"],
      "properties": {
        "name": {"$ref": "#/$defs/name"},
        "media_type": {"type": "string", "pattern": "^[a-z0-9][a-z0-9!#$&^_.+-]*/[a-z0-9][a-z0-9!#$&^_.+-]*$"},
        "digest": {"$ref": "#/$defs/digest"}
      }
    },
    "transformation": {
      "type": "object",
      "additionalProperties": false,
      "required": ["name", "revision"],
      "properties": {
        "name": {"$ref": "#/$defs/name"},
        "revision": {"$ref": "#/$defs/revision"}
      }
    }
  }
}
